{
  "name": "dotnet-ai-kit",
  "version": "2.0.0",
  "description": "AI dev tool plugin for the full .NET development lifecycle \u2014 authored once, projected to Claude Code, Codex CLI, Cursor, and GitHub Copilot.",
  "agents": ["./agents/ai-engineer.md", "./agents/api-designer.md", "./agents/aspire-architect.md", "./agents/command-architect.md", "./agents/controlpanel-architect.md", "./agents/cosmos-architect.md", "./agents/devops-engineer.md", "./agents/docs-engineer.md", "./agents/dotnet-architect.md", "./agents/ef-specialist.md", "./agents/gateway-architect.md", "./agents/processor-architect.md", "./agents/query-architect.md", "./agents/reviewer.md", "./agents/test-engineer.md"]
}
