{
  "name": "dotnet-ai-kit",
  "version": "1.0.0",
  "description": "Full .NET development lifecycle plugin: 27 commands, 124 skills, 13 specialist agents, 16 rules (5 conventions + 11 domain), 12 architecture profiles, SDD workflow, code generation, AI detection for VSA / Clean Arch / DDD / CQRS Microservices.",
  "agents": [
    "agents-claude/api-designer.md",
    "agents-claude/command-architect.md",
    "agents-claude/controlpanel-architect.md",
    "agents-claude/cosmos-architect.md",
    "agents-claude/devops-engineer.md",
    "agents-claude/docs-engineer.md",
    "agents-claude/dotnet-architect.md",
    "agents-claude/ef-specialist.md",
    "agents-claude/gateway-architect.md",
    "agents-claude/processor-architect.md",
    "agents-claude/query-architect.md",
    "agents-claude/reviewer.md",
    "agents-claude/test-engineer.md"
  ],
  "skills": [
    "skills/api/caching-strategies/SKILL.md",
    "skills/api/content-negotiation/SKILL.md",
    "skills/api/controller-patterns/SKILL.md",
    "skills/api/controllers/SKILL.md",
    "skills/api/grpc-design/SKILL.md",
    "skills/api/minimal-api/SKILL.md",
    "skills/api/openapi-scalar/SKILL.md",
    "skills/api/rate-limiting/SKILL.md",
    "skills/api/scalar/SKILL.md",
    "skills/api/signalr-realtime/SKILL.md",
    "skills/api/versioning/SKILL.md",
    "skills/architecture/advisor/SKILL.md",
    "skills/architecture/clean-architecture/SKILL.md",
    "skills/architecture/cqrs-basics/SKILL.md",
    "skills/architecture/ddd-patterns/SKILL.md",
    "skills/architecture/modular-monolith/SKILL.md",
    "skills/architecture/multi-tenancy/SKILL.md",
    "skills/architecture/vertical-slice/SKILL.md",
    "skills/core/async-patterns/SKILL.md",
    "skills/core/coding-conventions/SKILL.md",
    "skills/core/configuration/SKILL.md",
    "skills/core/csharp-idioms/SKILL.md",
    "skills/core/dependency-injection/SKILL.md",
    "skills/core/design-patterns/SKILL.md",
    "skills/core/error-handling/SKILL.md",
    "skills/core/fluent-validation/SKILL.md",
    "skills/core/functional-csharp/SKILL.md",
    "skills/core/mapping-strategies/SKILL.md",
    "skills/core/modern-csharp/SKILL.md",
    "skills/core/solid-principles/SKILL.md",
    "skills/cqrs/command-generator/SKILL.md",
    "skills/cqrs/mediatr-handlers/SKILL.md",
    "skills/cqrs/notification-handlers/SKILL.md",
    "skills/cqrs/pipeline-behaviors/SKILL.md",
    "skills/cqrs/query-generator/SKILL.md",
    "skills/cqrs/request-response/SKILL.md",
    "skills/data/audit-trail/SKILL.md",
    "skills/data/dapper/SKILL.md",
    "skills/data/db-transactions/SKILL.md",
    "skills/data/ef-core-basics/SKILL.md",
    "skills/data/ef-migrations/SKILL.md",
    "skills/data/ef-queries/SKILL.md",
    "skills/data/repository-patterns/SKILL.md",
    "skills/data/specification-pattern/SKILL.md",
    "skills/detection/smart-detect/SKILL.md",
    "skills/devops/aspire-orchestration/SKILL.md",
    "skills/devops/azure-resources/SKILL.md",
    "skills/devops/dockerfile/SKILL.md",
    "skills/devops/github-actions/SKILL.md",
    "skills/devops/kubernetes/SKILL.md",
    "skills/docs/adr/SKILL.md",
    "skills/docs/api-docs/SKILL.md",
    "skills/docs/architecture-docs/SKILL.md",
    "skills/docs/changelog-gen/SKILL.md",
    "skills/docs/diagram-gen/SKILL.md",
    "skills/docs/onboarding/SKILL.md",
    "skills/docs/readme-gen/SKILL.md",
    "skills/docs/runbook/SKILL.md",
    "skills/infra/background-jobs/SKILL.md",
    "skills/infra/email-notifications/SKILL.md",
    "skills/infra/feature-flags/SKILL.md",
    "skills/infra/file-storage/SKILL.md",
    "skills/microservice/command/aggregate-design/SKILL.md",
    "skills/microservice/command/aggregate-testing/SKILL.md",
    "skills/microservice/command/command-handler/SKILL.md",
    "skills/microservice/command/event-design/SKILL.md",
    "skills/microservice/command/event-store/SKILL.md",
    "skills/microservice/command/event-versioning/SKILL.md",
    "skills/microservice/command/outbox/SKILL.md",
    "skills/microservice/controlpanel/blazor-component/SKILL.md",
    "skills/microservice/controlpanel/gateway-facade/SKILL.md",
    "skills/microservice/controlpanel/mudblazor-patterns/SKILL.md",
    "skills/microservice/controlpanel/query-string-bindable/SKILL.md",
    "skills/microservice/controlpanel/response-result/SKILL.md",
    "skills/microservice/cosmos/cosmos-entity/SKILL.md",
    "skills/microservice/cosmos/cosmos-repository/SKILL.md",
    "skills/microservice/cosmos/partition-strategy/SKILL.md",
    "skills/microservice/cosmos/transactional-batch/SKILL.md",
    "skills/microservice/event-catalogue/SKILL.md",
    "skills/microservice/gateway/endpoint-registration/SKILL.md",
    "skills/microservice/gateway/gateway-endpoint/SKILL.md",
    "skills/microservice/gateway/gateway-security/SKILL.md",
    "skills/microservice/gateway/scalar-docs/SKILL.md",
    "skills/microservice/grpc/interceptors/SKILL.md",
    "skills/microservice/grpc/service-definition/SKILL.md",
    "skills/microservice/grpc/validation/SKILL.md",
    "skills/microservice/processor/batch-processing/SKILL.md",
    "skills/microservice/processor/event-routing/SKILL.md",
    "skills/microservice/processor/grpc-client/SKILL.md",
    "skills/microservice/processor/hosted-service/SKILL.md",
    "skills/microservice/query/event-handler/SKILL.md",
    "skills/microservice/query/listener-pattern/SKILL.md",
    "skills/microservice/query/query-entity/SKILL.md",
    "skills/microservice/query/query-handler/SKILL.md",
    "skills/microservice/query/sequence-checking/SKILL.md",
    "skills/observability/health-checks/SKILL.md",
    "skills/observability/opentelemetry/SKILL.md",
    "skills/observability/serilog-structured/SKILL.md",
    "skills/quality/architectural-fitness/SKILL.md",
    "skills/quality/code-analysis/SKILL.md",
    "skills/quality/review-checklist/SKILL.md",
    "skills/resilience/circuit-breaker/SKILL.md",
    "skills/resilience/polly-resilience/SKILL.md",
    "skills/resilience/retry-patterns/SKILL.md",
    "skills/security/auth-jwt/SKILL.md",
    "skills/security/auth-policies/SKILL.md",
    "skills/security/cors-configuration/SKILL.md",
    "skills/security/data-protection/SKILL.md",
    "skills/security/input-sanitization/SKILL.md",
    "skills/testing/integration-testing/SKILL.md",
    "skills/testing/performance-testing/SKILL.md",
    "skills/testing/test-fixtures/SKILL.md",
    "skills/testing/unit-testing/SKILL.md",
    "skills/workflow/code-review-workflow/SKILL.md",
    "skills/workflow/feature-tracking/SKILL.md",
    "skills/workflow/git-worktree-isolation/SKILL.md",
    "skills/workflow/multi-repo-workflow/SKILL.md",
    "skills/workflow/plan-artifacts/SKILL.md",
    "skills/workflow/plan-templates/SKILL.md",
    "skills/workflow/receiving-review-feedback/SKILL.md",
    "skills/workflow/sdd-lifecycle/SKILL.md",
    "skills/workflow/session-management/SKILL.md",
    "skills/workflow/systematic-debugging/SKILL.md",
    "skills/workflow/verification-gate/SKILL.md"
  ],
  "commands": [
    "commands/add-aggregate.md",
    "commands/add-crud.md",
    "commands/add-endpoint.md",
    "commands/add-entity.md",
    "commands/add-event.md",
    "commands/add-page.md",
    "commands/add-tests.md",
    "commands/analyze.md",
    "commands/checkpoint.md",
    "commands/clarify.md",
    "commands/configure.md",
    "commands/detect.md",
    "commands/do.md",
    "commands/docs.md",
    "commands/explain.md",
    "commands/implement.md",
    "commands/init.md",
    "commands/learn.md",
    "commands/plan.md",
    "commands/pr.md",
    "commands/review.md",
    "commands/specify.md",
    "commands/status.md",
    "commands/tasks.md",
    "commands/undo.md",
    "commands/verify.md",
    "commands/wrap-up.md"
  ],
  "hooks": {
    "configFile": "hooks/hooks.json"
  },
  "mcpServers": {
    "configFile": ".mcp.json"
  },
  "lspServers": "./.lsp.json"
}
